
*** Running vivado
    with args -log UART.vdi -applog -m64 -product Vivado -messageDb vivado.pb -mode batch -source UART.tcl -notrace


****** Vivado v2019.1 (64-bit)
  **** SW Build 2552052 on Fri May 24 14:49:42 MDT 2019
  **** IP Build 2548770 on Fri May 24 18:01:18 MDT 2019
    ** Copyright 1986-2019 Xilinx, Inc. All Rights Reserved.

source UART.tcl -notrace
Command: link_design -top UART -part xc7z010clg400-2
Design is defaulting to srcset: sources_1
Design is defaulting to constrset: constrs_1
INFO: [Device 21-403] Loading part xc7z010clg400-2
INFO: [Project 1-479] Netlist was created with Vivado 2019.1
INFO: [Project 1-570] Preparing netlist for logic optimization
Parsing XDC File [F:/project/EX4-1_OFFICIAL/EX4-1_OFFICIAL.srcs/constrs_1/new/UART.xdc]
Finished Parsing XDC File [F:/project/EX4-1_OFFICIAL/EX4-1_OFFICIAL.srcs/constrs_1/new/UART.xdc]
INFO: [Opt 31-138] Pushed 0 inverter(s) to 0 load pin(s).
Netlist sorting complete. Time (s): cpu = 00:00:00 ; elapsed = 00:00:00.001 . Memory (MB): peak = 736.016 ; gain = 0.000
INFO: [Project 1-111] Unisim Transformation Summary:
No Unisim elements were transformed.

5 Infos, 0 Warnings, 0 Critical Warnings and 0 Errors encountered.
link_design completed successfully
link_design: Time (s): cpu = 00:00:05 ; elapsed = 00:00:06 . Memory (MB): peak = 740.043 ; gain = 379.781
Command: opt_design
Attempting to get a license for feature 'Implementation' and/or device 'xc7z010'
INFO: [Common 17-349] Got license for feature 'Implementation' and/or device 'xc7z010'
Running DRC as a precondition to command opt_design

Starting DRC Task
INFO: [DRC 23-27] Running DRC with 2 threads
INFO: [Project 1-461] DRC finished with 0 Errors
INFO: [Project 1-462] Please refer to the DRC report (report_drc) for more information.

Time (s): cpu = 00:00:00 ; elapsed = 00:00:00.094 . Memory (MB): peak = 740.043 ; gain = 0.000

Starting Cache Timing Information Task
INFO: [Timing 38-35] Done setting XDC timing constraints.
Ending Cache Timing Information Task | Checksum: 1898eeecf

Time (s): cpu = 00:00:06 ; elapsed = 00:00:06 . Memory (MB): peak = 1236.004 ; gain = 495.961

Starting Logic Optimization Task

Phase 1 Retarget
INFO: [Opt 31-138] Pushed 0 inverter(s) to 0 load pin(s).
INFO: [Opt 31-49] Retargeted 0 cell(s).
Phase 1 Retarget | Checksum: 1898eeecf

Time (s): cpu = 00:00:00 ; elapsed = 00:00:00.004 . Memory (MB): peak = 1379.082 ; gain = 0.000
INFO: [Opt 31-389] Phase Retarget created 0 cells and removed 0 cells

Phase 2 Constant propagation
INFO: [Opt 31-138] Pushed 0 inverter(s) to 0 load pin(s).
Phase 2 Constant propagation | Checksum: 1898eeecf

Time (s): cpu = 00:00:00 ; elapsed = 00:00:00.005 . Memory (MB): peak = 1379.082 ; gain = 0.000
INFO: [Opt 31-389] Phase Constant propagation created 0 cells and removed 0 cells

Phase 3 Sweep
Phase 3 Sweep | Checksum: 1898eeecf

Time (s): cpu = 00:00:00 ; elapsed = 00:00:00.005 . Memory (MB): peak = 1379.082 ; gain = 0.000
INFO: [Opt 31-389] Phase Sweep created 0 cells and removed 0 cells

Phase 4 BUFG optimization
Phase 4 BUFG optimization | Checksum: 1898eeecf

Time (s): cpu = 00:00:00 ; elapsed = 00:00:00.006 . Memory (MB): peak = 1379.082 ; gain = 0.000
INFO: [Opt 31-662] Phase BUFG optimization created 0 cells of which 0 are BUFGs and removed 0 cells.

Phase 5 Shift Register Optimization
INFO: [Opt 31-1064] SRL Remap converted 0 SRLs to 0 registers and converted 0 registers of register chains to 0 SRLs
Phase 5 Shift Register Optimization | Checksum: 1898eeecf

Time (s): cpu = 00:00:00 ; elapsed = 00:00:00.007 . Memory (MB): peak = 1379.082 ; gain = 0.000
INFO: [Opt 31-389] Phase Shift Register Optimization created 0 cells and removed 0 cells

Phase 6 Post Processing Netlist
Phase 6 Post Processing Netlist | Checksum: 1898eeecf

Time (s): cpu = 00:00:00 ; elapsed = 00:00:00.007 . Memory (MB): peak = 1379.082 ; gain = 0.000
INFO: [Opt 31-389] Phase Post Processing Netlist created 0 cells and removed 0 cells
Opt_design Change Summary
=========================


-------------------------------------------------------------------------------------------------------------------------
|  Phase                        |  #Cells created  |  #Cells Removed  |  #Constrained objects preventing optimizations  |
-------------------------------------------------------------------------------------------------------------------------
|  Retarget                     |               0  |               0  |                                              0  |
|  Constant propagation         |               0  |               0  |                                              0  |
|  Sweep                        |               0  |               0  |                                              0  |
|  BUFG optimization            |               0  |               0  |                                              0  |
|  Shift Register Optimization  |               0  |               0  |                                              0  |
|  Post Processing Netlist      |               0  |               0  |                                              0  |
-------------------------------------------------------------------------------------------------------------------------



Starting Connectivity Check Task

Time (s): cpu = 00:00:00 ; elapsed = 00:00:00 . Memory (MB): peak = 1379.082 ; gain = 0.000
Ending Logic Optimization Task | Checksum: 1898eeecf

Time (s): cpu = 00:00:00 ; elapsed = 00:00:00.009 . Memory (MB): peak = 1379.082 ; gain = 0.000

Starting Power Optimization Task
INFO: [Pwropt 34-132] Skipping clock gating for clocks with a period < 2.00 ns.
Ending Power Optimization Task | Checksum: 1898eeecf

Time (s): cpu = 00:00:00 ; elapsed = 00:00:00.006 . Memory (MB): peak = 1379.082 ; gain = 0.000

Starting Final Cleanup Task
Ending Final Cleanup Task | Checksum: 1898eeecf

Time (s): cpu = 00:00:00 ; elapsed = 00:00:00 . Memory (MB): peak = 1379.082 ; gain = 0.000

Starting Netlist Obfuscation Task
Netlist sorting complete. Time (s): cpu = 00:00:00 ; elapsed = 00:00:00 . Memory (MB): peak = 1379.082 ; gain = 0.000
Ending Netlist Obfuscation Task | Checksum: 1898eeecf

Time (s): cpu = 00:00:00 ; elapsed = 00:00:00.001 . Memory (MB): peak = 1379.082 ; gain = 0.000
INFO: [Common 17-83] Releasing license: Implementation
22 Infos, 0 Warnings, 0 Critical Warnings and 0 Errors encountered.
opt_design completed successfully
opt_design: Time (s): cpu = 00:00:07 ; elapsed = 00:00:07 . Memory (MB): peak = 1379.082 ; gain = 639.039
Netlist sorting complete. Time (s): cpu = 00:00:00 ; elapsed = 00:00:00 . Memory (MB): peak = 1379.082 ; gain = 0.000
INFO: [Timing 38-480] Writing timing data to binary archive.
Writing placer database...
Writing XDEF routing.
Writing XDEF routing logical nets.
Writing XDEF routing special nets.
Write XDEF Complete: Time (s): cpu = 00:00:00 ; elapsed = 00:00:00.033 . Memory (MB): peak = 1379.082 ; gain = 0.000
INFO: [Common 17-1381] The checkpoint 'F:/project/EX4-1_OFFICIAL/EX4-1_OFFICIAL.runs/impl_1/UART_opt.dcp' has been generated.
INFO: [runtcl-4] Executing : report_drc -file UART_drc_opted.rpt -pb UART_drc_opted.pb -rpx UART_drc_opted.rpx
Command: report_drc -file UART_drc_opted.rpt -pb UART_drc_opted.pb -rpx UART_drc_opted.rpx
INFO: [IP_Flow 19-234] Refreshing IP repositories
INFO: [IP_Flow 19-1704] No user IP repositories specified
INFO: [IP_Flow 19-2313] Loaded Vivado IP repository 'F:/Xilinx/Vivado/2019.1/data/ip'.
INFO: [DRC 23-27] Running DRC with 2 threads
INFO: [Coretcl 2-168] The results of DRC are in file F:/project/EX4-1_OFFICIAL/EX4-1_OFFICIAL.runs/impl_1/UART_drc_opted.rpt.
report_drc completed successfully
Command: place_design
Attempting to get a license for feature 'Implementation' and/or device 'xc7z010'
INFO: [Common 17-349] Got license for feature 'Implementation' and/or device 'xc7z010'
INFO: [DRC 23-27] Running DRC with 2 threads
INFO: [Vivado_Tcl 4-198] DRC finished with 0 Errors
INFO: [Vivado_Tcl 4-199] Please refer to the DRC report (report_drc) for more information.
Running DRC as a precondition to command place_design
INFO: [DRC 23-27] Running DRC with 2 threads
INFO: [Vivado_Tcl 4-198] DRC finished with 0 Errors
INFO: [Vivado_Tcl 4-199] Please refer to the DRC report (report_drc) for more information.

Starting Placer Task
INFO: [Place 30-611] Multithreading enabled for place_design using a maximum of 2 CPUs

Phase 1 Placer Initialization

Phase 1.1 Placer Initialization Netlist Sorting
Netlist sorting complete. Time (s): cpu = 00:00:00 ; elapsed = 00:00:00 . Memory (MB): peak = 1381.742 ; gain = 0.000
Phase 1.1 Placer Initialization Netlist Sorting | Checksum: 1494c07bc

Time (s): cpu = 00:00:00 ; elapsed = 00:00:00.003 . Memory (MB): peak = 1381.742 ; gain = 0.000
Netlist sorting complete. Time (s): cpu = 00:00:00 ; elapsed = 00:00:00 . Memory (MB): peak = 1381.742 ; gain = 0.000

Phase 1.2 IO Placement/ Clock Placement/ Build Placer Device
INFO: [Timing 38-35] Done setting XDC timing constraints.
Phase 1.2 IO Placement/ Clock Placement/ Build Placer Device | Checksum: 144057bc9

Time (s): cpu = 00:00:01 ; elapsed = 00:00:00.197 . Memory (MB): peak = 1392.020 ; gain = 10.277

Phase 1.3 Build Placer Netlist Model
Phase 1.3 Build Placer Netlist Model | Checksum: 1e6067e1e

Time (s): cpu = 00:00:01 ; elapsed = 00:00:00.203 . Memory (MB): peak = 1392.020 ; gain = 10.277

Phase 1.4 Constrain Clocks/Macros
Phase 1.4 Constrain Clocks/Macros | Checksum: 1e6067e1e

Time (s): cpu = 00:00:01 ; elapsed = 00:00:00.204 . Memory (MB): peak = 1392.020 ; gain = 10.277
Phase 1 Placer Initialization | Checksum: 1e6067e1e

Time (s): cpu = 00:00:01 ; elapsed = 00:00:00.204 . Memory (MB): peak = 1392.020 ; gain = 10.277

Phase 2 Global Placement

Phase 2.1 Floorplanning
Phase 2.1 Floorplanning | Checksum: 1e6067e1e

Time (s): cpu = 00:00:01 ; elapsed = 00:00:00.206 . Memory (MB): peak = 1392.020 ; gain = 10.277

Phase 2.2 Global Placement Core
WARNING: [Place 46-29] place_design is not in timing mode. Skip physical synthesis in placer
Phase 2.2 Global Placement Core | Checksum: 1abc3470d

Time (s): cpu = 00:00:01 ; elapsed = 00:00:00.546 . Memory (MB): peak = 1392.020 ; gain = 10.277
Phase 2 Global Placement | Checksum: 1abc3470d

Time (s): cpu = 00:00:01 ; elapsed = 00:00:00.547 . Memory (MB): peak = 1392.020 ; gain = 10.277

Phase 3 Detail Placement

Phase 3.1 Commit Multi Column Macros
Phase 3.1 Commit Multi Column Macros | Checksum: 1abc3470d

Time (s): cpu = 00:00:01 ; elapsed = 00:00:00.548 . Memory (MB): peak = 1392.020 ; gain = 10.277

Phase 3.2 Commit Most Macros & LUTRAMs
Phase 3.2 Commit Most Macros & LUTRAMs | Checksum: 223a961a5

Time (s): cpu = 00:00:01 ; elapsed = 00:00:00.551 . Memory (MB): peak = 1392.020 ; gain = 10.277

Phase 3.3 Area Swap Optimization
Phase 3.3 Area Swap Optimization | Checksum: 1abc3470d

Time (s): cpu = 00:00:01 ; elapsed = 00:00:00.557 . Memory (MB): peak = 1392.020 ; gain = 10.277

Phase 3.4 Pipeline Register Optimization
Phase 3.4 Pipeline Register Optimization | Checksum: 1abc3470d

Time (s): cpu = 00:00:01 ; elapsed = 00:00:00.558 . Memory (MB): peak = 1392.020 ; gain = 10.277

Phase 3.5 Small Shape Detail Placement
Phase 3.5 Small Shape Detail Placement | Checksum: 2402f3b69

Time (s): cpu = 00:00:01 ; elapsed = 00:00:00.612 . Memory (MB): peak = 1392.020 ; gain = 10.277

Phase 3.6 Re-assign LUT pins
Phase 3.6 Re-assign LUT pins | Checksum: 2402f3b69

Time (s): cpu = 00:00:01 ; elapsed = 00:00:00.613 . Memory (MB): peak = 1392.020 ; gain = 10.277

Phase 3.7 Pipeline Register Optimization
Phase 3.7 Pipeline Register Optimization | Checksum: 2402f3b69

Time (s): cpu = 00:00:01 ; elapsed = 00:00:00.613 . Memory (MB): peak = 1392.020 ; gain = 10.277
Phase 3 Detail Placement | Checksum: 2402f3b69

Time (s): cpu = 00:00:01 ; elapsed = 00:00:00.614 . Memory (MB): peak = 1392.020 ; gain = 10.277

Phase 4 Post Placement Optimization and Clean-Up

Phase 4.1 Post Commit Optimization
Phase 4.1 Post Commit Optimization | Checksum: 2402f3b69

Time (s): cpu = 00:00:01 ; elapsed = 00:00:00.615 . Memory (MB): peak = 1392.020 ; gain = 10.277

Phase 4.2 Post Placement Cleanup
Phase 4.2 Post Placement Cleanup | Checksum: 2402f3b69

Time (s): cpu = 00:00:01 ; elapsed = 00:00:00.616 . Memory (MB): peak = 1392.020 ; gain = 10.277

Phase 4.3 Placer Reporting
Phase 4.3 Placer Reporting | Checksum: 2402f3b69

Time (s): cpu = 00:00:01 ; elapsed = 00:00:00.616 . Memory (MB): peak = 1392.020 ; gain = 10.277

Phase 4.4 Final Placement Cleanup
Netlist sorting complete. Time (s): cpu = 00:00:00 ; elapsed = 00:00:00 . Memory (MB): peak = 1392.020 ; gain = 0.000
Phase 4.4 Final Placement Cleanup | Checksum: 2402f3b69

Time (s): cpu = 00:00:01 ; elapsed = 00:00:00.617 . Memory (MB): peak = 1392.020 ; gain = 10.277
Phase 4 Post Placement Optimization and Clean-Up | Checksum: 2402f3b69

Time (s): cpu = 00:00:01 ; elapsed = 00:00:00.617 . Memory (MB): peak = 1392.020 ; gain = 10.277
Ending Placer Task | Checksum: 184e749c3

Time (s): cpu = 00:00:01 ; elapsed = 00:00:00.617 . Memory (MB): peak = 1392.020 ; gain = 10.277
INFO: [Common 17-83] Releasing license: Implementation
40 Infos, 1 Warnings, 0 Critical Warnings and 0 Errors encountered.
place_design completed successfully
Netlist sorting complete. Time (s): cpu = 00:00:00 ; elapsed = 00:00:00 . Memory (MB): peak = 1392.020 ; gain = 0.000
INFO: [Timing 38-480] Writing timing data to binary archive.
Writing placer database...
Writing XDEF routing.
Writing XDEF routing logical nets.
Writing XDEF routing special nets.
Write XDEF Complete: Time (s): cpu = 00:00:00 ; elapsed = 00:00:00.036 . Memory (MB): peak = 1399.059 ; gain = 7.039
INFO: [Common 17-1381] The checkpoint 'F:/project/EX4-1_OFFICIAL/EX4-1_OFFICIAL.runs/impl_1/UART_placed.dcp' has been generated.
INFO: [runtcl-4] Executing : report_io -file UART_io_placed.rpt
report_io: Time (s): cpu = 00:00:00 ; elapsed = 00:00:00.035 . Memory (MB): peak = 1399.059 ; gain = 0.000
INFO: [runtcl-4] Executing : report_utilization -file UART_utilization_placed.rpt -pb UART_utilization_placed.pb
INFO: [runtcl-4] Executing : report_control_sets -verbose -file UART_control_sets_placed.rpt
report_control_sets: Time (s): cpu = 00:00:00 ; elapsed = 00:00:00.001 . Memory (MB): peak = 1399.059 ; gain = 0.000
Command: route_design
Attempting to get a license for feature 'Implementation' and/or device 'xc7z010'
INFO: [Common 17-349] Got license for feature 'Implementation' and/or device 'xc7z010'
Running DRC as a precondition to command route_design
INFO: [DRC 23-27] Running DRC with 2 threads
INFO: [Vivado_Tcl 4-198] DRC finished with 0 Errors
INFO: [Vivado_Tcl 4-199] Please refer to the DRC report (report_drc) for more information.


Starting Routing Task
INFO: [Route 35-254] Multithreading enabled for route_design using a maximum of 2 CPUs
Checksum: PlaceDB: a3fa5c98 ConstDB: 0 ShapeSum: e0eced2b RouteDB: 0

Phase 1 Build RT Design
Phase 1 Build RT Design | Checksum: 1189745aa

Time (s): cpu = 00:00:09 ; elapsed = 00:00:08 . Memory (MB): peak = 1459.484 ; gain = 44.266
Post Restoration Checksum: NetGraph: ce39154a NumContArr: 4a5e3060 Constraints: 0 Timing: 0

Phase 2 Router Initialization
INFO: [Route 35-64] No timing constraints were detected. The router will operate in resource-optimization mode.

Phase 2.1 Fix Topology Constraints
Phase 2.1 Fix Topology Constraints | Checksum: 1189745aa

Time (s): cpu = 00:00:09 ; elapsed = 00:00:08 . Memory (MB): peak = 1465.527 ; gain = 50.309

Phase 2.2 Pre Route Cleanup
Phase 2.2 Pre Route Cleanup | Checksum: 1189745aa

Time (s): cpu = 00:00:09 ; elapsed = 00:00:08 . Memory (MB): peak = 1465.527 ; gain = 50.309
 Number of Nodes with overlaps = 0
Phase 2 Router Initialization | Checksum: 1cb0a823a

Time (s): cpu = 00:00:09 ; elapsed = 00:00:08 . Memory (MB): peak = 1467.891 ; gain = 52.672

Router Utilization Summary
  Global Vertical Routing Utilization    = 0 %
  Global Horizontal Routing Utilization  = 0 %
  Routable Net Status*
  *Does not include unroutable nets such as driverless and loadless.
  Run report_route_status for detailed report.
  Number of Failed Nets               = 2
    (Failed Nets is the sum of unrouted and partially routed nets)
  Number of Unrouted Nets             = 2
  Number of Partially Routed Nets     = 0
  Number of Node Overlaps             = 0


Phase 3 Initial Routing
 Number of Nodes with overlaps = 0
Phase 3 Initial Routing | Checksum: cc3d30aa

Time (s): cpu = 00:00:09 ; elapsed = 00:00:08 . Memory (MB): peak = 1469.910 ; gain = 54.691

Phase 4 Rip-up And Reroute

Phase 4.1 Global Iteration 0
Phase 4.1 Global Iteration 0 | Checksum: cc3d30aa

Time (s): cpu = 00:00:09 ; elapsed = 00:00:08 . Memory (MB): peak = 1469.910 ; gain = 54.691
Phase 4 Rip-up And Reroute | Checksum: cc3d30aa

Time (s): cpu = 00:00:09 ; elapsed = 00:00:08 . Memory (MB): peak = 1469.910 ; gain = 54.691

Phase 5 Delay and Skew Optimization
Phase 5 Delay and Skew Optimization | Checksum: cc3d30aa

Time (s): cpu = 00:00:09 ; elapsed = 00:00:08 . Memory (MB): peak = 1469.910 ; gain = 54.691

Phase 6 Post Hold Fix

Phase 6.1 Hold Fix Iter
Phase 6.1 Hold Fix Iter | Checksum: cc3d30aa

Time (s): cpu = 00:00:09 ; elapsed = 00:00:08 . Memory (MB): peak = 1469.910 ; gain = 54.691
Phase 6 Post Hold Fix | Checksum: cc3d30aa

Time (s): cpu = 00:00:09 ; elapsed = 00:00:08 . Memory (MB): peak = 1469.910 ; gain = 54.691

Phase 7 Route finalize

Router Utilization Summary
  Global Vertical Routing Utilization    = 0.000140766 %
  Global Horizontal Routing Utilization  = 0.000919118 %
  Routable Net Status*
  *Does not include unroutable nets such as driverless and loadless.
  Run report_route_status for detailed report.
  Number of Failed Nets               = 0
    (Failed Nets is the sum of unrouted and partially routed nets)
  Number of Unrouted Nets             = 0
  Number of Partially Routed Nets     = 0
  Number of Node Overlaps             = 0

Congestion Report
North Dir 1x1 Area, Max Cong = 0%, No Congested Regions.
South Dir 1x1 Area, Max Cong = 0.900901%, No Congested Regions.
East Dir 1x1 Area, Max Cong = 1.47059%, No Congested Regions.
West Dir 1x1 Area, Max Cong = 2.94118%, No Congested Regions.

------------------------------
Reporting congestion hotspots
------------------------------
Direction: North
----------------
Congested clusters found at Level 0
Effective congestion level: 0 Aspect Ratio: 1 Sparse Ratio: 0
Direction: South
----------------
Congested clusters found at Level 0
Effective congestion level: 0 Aspect Ratio: 1 Sparse Ratio: 0
Direction: East
----------------
Congested clusters found at Level 0
Effective congestion level: 0 Aspect Ratio: 1 Sparse Ratio: 0
Direction: West
----------------
Congested clusters found at Level 0
Effective congestion level: 0 Aspect Ratio: 1 Sparse Ratio: 0

Phase 7 Route finalize | Checksum: cc3d30aa

Time (s): cpu = 00:00:09 ; elapsed = 00:00:09 . Memory (MB): peak = 1469.910 ; gain = 54.691

Phase 8 Verifying routed nets

 Verification completed successfully
Phase 8 Verifying routed nets | Checksum: cc3d30aa

Time (s): cpu = 00:00:09 ; elapsed = 00:00:09 . Memory (MB): peak = 1471.973 ; gain = 56.754

Phase 9 Depositing Routes
Phase 9 Depositing Routes | Checksum: cc3d30aa

Time (s): cpu = 00:00:09 ; elapsed = 00:00:09 . Memory (MB): peak = 1471.973 ; gain = 56.754
INFO: [Route 35-16] Router Completed Successfully

Time (s): cpu = 00:00:09 ; elapsed = 00:00:09 . Memory (MB): peak = 1471.973 ; gain = 56.754

Routing Is Done.
INFO: [Common 17-83] Releasing license: Implementation
53 Infos, 1 Warnings, 0 Critical Warnings and 0 Errors encountered.
route_design completed successfully
route_design: Time (s): cpu = 00:00:09 ; elapsed = 00:00:09 . Memory (MB): peak = 1471.973 ; gain = 72.914
Netlist sorting complete. Time (s): cpu = 00:00:00 ; elapsed = 00:00:00 . Memory (MB): peak = 1471.973 ; gain = 0.000
INFO: [Timing 38-480] Writing timing data to binary archive.
Writing placer database...
Writing XDEF routing.
Writing XDEF routing logical nets.
Writing XDEF routing special nets.
Write XDEF Complete: Time (s): cpu = 00:00:00 ; elapsed = 00:00:00.033 . Memory (MB): peak = 1481.812 ; gain = 9.840
INFO: [Common 17-1381] The checkpoint 'F:/project/EX4-1_OFFICIAL/EX4-1_OFFICIAL.runs/impl_1/UART_routed.dcp' has been generated.
INFO: [runtcl-4] Executing : report_drc -file UART_drc_routed.rpt -pb UART_drc_routed.pb -rpx UART_drc_routed.rpx
Command: report_drc -file UART_drc_routed.rpt -pb UART_drc_routed.pb -rpx UART_drc_routed.rpx
INFO: [IP_Flow 19-1839] IP Catalog is up to date.
INFO: [DRC 23-27] Running DRC with 2 threads
INFO: [Coretcl 2-168] The results of DRC are in file F:/project/EX4-1_OFFICIAL/EX4-1_OFFICIAL.runs/impl_1/UART_drc_routed.rpt.
report_drc completed successfully
INFO: [runtcl-4] Executing : report_methodology -file UART_methodology_drc_routed.rpt -pb UART_methodology_drc_routed.pb -rpx UART_methodology_drc_routed.rpx
Command: report_methodology -file UART_methodology_drc_routed.rpt -pb UART_methodology_drc_routed.pb -rpx UART_methodology_drc_routed.rpx
INFO: [Timing 38-35] Done setting XDC timing constraints.
INFO: [DRC 23-133] Running Methodology with 2 threads
INFO: [Coretcl 2-1520] The results of Report Methodology are in file F:/project/EX4-1_OFFICIAL/EX4-1_OFFICIAL.runs/impl_1/UART_methodology_drc_routed.rpt.
report_methodology completed successfully
INFO: [runtcl-4] Executing : report_power -file UART_power_routed.rpt -pb UART_power_summary_routed.pb -rpx UART_power_routed.rpx
Command: report_power -file UART_power_routed.rpt -pb UART_power_summary_routed.pb -rpx UART_power_routed.rpx
INFO: [Timing 38-35] Done setting XDC timing constraints.
WARNING: [Power 33-232] No user defined clocks were found in the design! Power estimation will be inaccurate until this is corrected.
Resolution: Please specify clocks using create_clock/create_generated_clock for sequential elements. For pure combinatorial circuits, please specify a virtual clock, otherwise the vectorless estimation might be inaccurate
Running Vector-less Activity Propagation...

Finished Running Vector-less Activity Propagation
65 Infos, 2 Warnings, 0 Critical Warnings and 0 Errors encountered.
report_power completed successfully
INFO: [runtcl-4] Executing : report_route_status -file UART_route_status.rpt -pb UART_route_status.pb
INFO: [runtcl-4] Executing : report_timing_summary -max_paths 10 -file UART_timing_summary_routed.rpt -pb UART_timing_summary_routed.pb -rpx UART_timing_summary_routed.rpx -warn_on_violation 
INFO: [Timing 38-91] UpdateTimingParams: Speed grade: -2, Delay Type: min_max.
INFO: [Timing 38-191] Multithreading enabled for timing update using a maximum of 2 CPUs
WARNING: [Timing 38-313] There are no user specified timing constraints. Timing constraints are needed for proper timing analysis.
INFO: [runtcl-4] Executing : report_incremental_reuse -file UART_incremental_reuse_routed.rpt
INFO: [Vivado_Tcl 4-1062] Incremental flow is disabled. No incremental reuse Info to report.
INFO: [runtcl-4] Executing : report_clock_utilization -file UART_clock_utilization_routed.rpt
INFO: [runtcl-4] Executing : report_bus_skew -warn_on_violation -file UART_bus_skew_routed.rpt -pb UART_bus_skew_routed.pb -rpx UART_bus_skew_routed.rpx
INFO: [Timing 38-91] UpdateTimingParams: Speed grade: -2, Delay Type: min_max.
INFO: [Timing 38-191] Multithreading enabled for timing update using a maximum of 2 CPUs
INFO: [Common 17-206] Exiting Vivado at Wed Dec 14 16:57:48 2022...

*** Running vivado
    with args -log UART.vdi -applog -m64 -product Vivado -messageDb vivado.pb -mode batch -source UART.tcl -notrace


****** Vivado v2019.1 (64-bit)
  **** SW Build 2552052 on Fri May 24 14:49:42 MDT 2019
  **** IP Build 2548770 on Fri May 24 18:01:18 MDT 2019
    ** Copyright 1986-2019 Xilinx, Inc. All Rights Reserved.

source UART.tcl -notrace
Command: open_checkpoint UART_routed.dcp

Starting open_checkpoint Task

Time (s): cpu = 00:00:00 ; elapsed = 00:00:00.028 . Memory (MB): peak = 298.355 ; gain = 0.000
INFO: [Device 21-403] Loading part xc7z010clg400-2
INFO: [Project 1-479] Netlist was created with Vivado 2019.1
INFO: [Project 1-570] Preparing netlist for logic optimization
INFO: [Timing 38-478] Restoring timing data from binary archive.
INFO: [Timing 38-479] Binary timing data restore complete.
INFO: [Project 1-856] Restoring constraints from binary archive.
INFO: [Project 1-853] Binary constraint restore complete.
Reading XDEF placement.
Reading placer database...
Reading XDEF routing.
Read XDEF File: Time (s): cpu = 00:00:00 ; elapsed = 00:00:00.079 . Memory (MB): peak = 1240.582 ; gain = 15.473
Restored from archive | CPU: 0.000000 secs | Memory: 0.000000 MB |
Finished XDEF File Restore: Time (s): cpu = 00:00:00 ; elapsed = 00:00:00.079 . Memory (MB): peak = 1240.582 ; gain = 15.473
Netlist sorting complete. Time (s): cpu = 00:00:00 ; elapsed = 00:00:00 . Memory (MB): peak = 1240.582 ; gain = 0.000
INFO: [Project 1-111] Unisim Transformation Summary:
No Unisim elements were transformed.

INFO: [Project 1-604] Checkpoint was created with Vivado v2019.1 (64-bit) build 2552052
open_checkpoint: Time (s): cpu = 00:00:12 ; elapsed = 00:00:13 . Memory (MB): peak = 1240.582 ; gain = 942.227
Command: write_bitstream -force UART.bit
Attempting to get a license for feature 'Implementation' and/or device 'xc7z010'
INFO: [Common 17-349] Got license for feature 'Implementation' and/or device 'xc7z010'
Running DRC as a precondition to command write_bitstream
INFO: [IP_Flow 19-234] Refreshing IP repositories
INFO: [IP_Flow 19-1704] No user IP repositories specified
INFO: [IP_Flow 19-2313] Loaded Vivado IP repository 'F:/Xilinx/Vivado/2019.1/data/ip'.
INFO: [DRC 23-27] Running DRC with 2 threads
WARNING: [DRC ZPS7-1] PS7 block required: The PS7 cell must be used in this Zynq design in order to enable correct default configuration.
INFO: [Vivado 12-3199] DRC finished with 0 Errors, 1 Warnings
INFO: [Vivado 12-3200] Please refer to the DRC report (report_drc) for more information.
INFO: [Designutils 20-2272] Running write_bitstream with 2 threads.
Loading data files...
Loading site data...
Loading route data...
Processing options...
Creating bitmap...
Creating bitstream...
Writing bitstream ./UART.bit...
INFO: [Vivado 12-1842] Bitgen Completed Successfully.
INFO: [Project 1-120] WebTalk data collection is mandatory when using a WebPACK part without a full Vivado license. To see the specific WebTalk data collected for your design, open the usage_statistics_webtalk.html or usage_statistics_webtalk.xml file in the implementation directory.
INFO: [Common 17-83] Releasing license: Implementation
20 Infos, 1 Warnings, 0 Critical Warnings and 0 Errors encountered.
write_bitstream completed successfully
write_bitstream: Time (s): cpu = 00:00:08 ; elapsed = 00:00:13 . Memory (MB): peak = 1675.434 ; gain = 434.852
INFO: [Common 17-206] Exiting Vivado at Wed Dec 14 16:58:35 2022...
